{
  "decision_id": "DEC-20260518-153500-motivation",
  "decision_maker": "human_director",
  "decision_type": "canonize",
  "target_ref": "PROP-20260518-153000-motivation",
  "decision_summary": "Canonize survival as the initial protagonist motivation for the prototype. Keep rescue as rejected for this stage because it expands character scope too early.",
  "accepted_scope": [
    "The protagonist's initial motivation is survival.",
    "This canon applies to early prototype scenario and player motivation work."
  ],
  "rejected_scope": [
    "Do not introduce a rescue target or supporting cast for the current prototype stage.",
    "Do not expand this decision into a full narrative bible."
  ],
  "conditions": [
    "If the core loop changes, this canon may be superseded by a later Human Director decision.",
    "Implementation work still requires a separate WorkOrder and AIWorkflow task approval."
  ],
  "timestamp": "2026-05-18T15:35:00+09:00",
  "evidence_refs": [
    "PROP-20260518-153000-motivation",
    "MEET-20260518-151000-scenario"
  ]
}
