{
    "decision_id":  "DEC-20260522-162828-prop-20260520-120958-director-goal-d",
    "decision_maker":  "human_director",
    "decision_type":  "reject",
    "target_ref":  "PROP-20260520-120958-director-goal-direction-studio-ux-im",
    "decision_summary":  "reject: Director goal direction: Studio UX improvement goal: Home 화면에서 Human Director가 지금 판단해야 할 일, 최근 작업 상태, 다음 행동을 더 직관적으로 이해할 수 있게 개선 방향을 기획해줘.",
    "accepted_scope":  [

                       ],
    "rejected_scope":  [
                           "이 목표는 executive_production, engineering, qa_testing 관점에서 분해하고, 감독자 승인이 필요한 항목을 먼저 분리해야 합니다."
                       ],
    "conditions":  [
                       "Known risk: 소스, 데이터, 런타임, 검증 경계를 명확히 해야 합니다."
                   ],
    "timestamp":  "2026-05-22T07:28:28.354Z",
    "evidence_refs":  [
                          "PROP-20260520-120958-director-goal-direction-studio-ux-im",
                          "DGP-20260520-120958-studio-ux-improvement-goal-home-huma",
                          "DGP-20260520-120958-studio-ux-improvement-goal-home-huma"
                      ]
}
